{
  "$schema": "https://astro-game-lab.github.io/hohmann-heist/schema/scenario-1.json",
  "id": "c01-shakedown",
  "version": 1,
  "act": 1,
  "index": 1,
  "title": "Shakedown",
  "briefKey": "brief.c01",
  "clientKey": "client.ferroCombine",
  "fee_kcr": 2,
  "epoch": {
    "scale": "TAI",
    "j2000Seconds": 0
  },
  "horizonSeconds": 10800,
  "ship": {
    "state": {
      "kind": "elements",
      "a_m": 6803137,
      "e": 0.0036747753279112267,
      "i_rad": 0,
      "raan_rad": 0,
      "argp_rad": 0,
      "nu_rad": 3.141592653589793
    },
    "dvBudget_mps": 200
  },
  "targets": [],
  "objective": {
    "kind": "reach_orbit",
    "goal": {
      "a_m": 6978137,
      "e": 0.028660944891165076,
      "i_rad": 0
    }
  },
  "constraints": [
    {
      "kind": "altitude_floor",
      "min_m": 100000
    },
    {
      "kind": "deadline",
      "seconds": 5400
    }
  ],
  "par": {
    "dv_mps": 95.0405,
    "time_s": 2792.189,
    "burns": 1,
    "derivation": "Closed-form hohmann transfer in 1 impulse, with the departure epoch swept across one revolution (361 samples) and refined to the centre of the goal's tolerance band, then evaluated as a quantised plan through the game's own timeline. Best known, not a proven optimum (DEP-12). Solver: tools/pars/solve.ts. Derivation: docs/PARS.md#c01-shakedown.",
    "referenceReplay": "{\"a\":0,\"c\":{\"dv\":950,\"t\":2792},\"e\":1,\"n\":[[2859202,950405,0,0]],\"s\":\"c01-shakedown\",\"v\":1}"
  },
  "unlocks": [],
  "assistsAllowed": ["closest_approach", "coach_marks", "constraints", "elements", "snapping"],
  "coachMarks": ["mark.c01.oppositeSide"]
}
